[{"code":"H","credibility":"high-credibility","name":"High Credibility","pretty":"High Credibility"},{"code":"M","credibility":"medium-credibility","name":"Medium Credibility","pretty":"Medium Credibility"},{"code":"L","credibility":"low-credibility","name":"Low Credibility","pretty":"Low Credibility"},{"code":"NA","credibility":"n/a","name":"N/A","pretty":"N/A"}]